{
  "schema_version": "1.0.0",
  "spec_id": "manual-preprocessing-v1",
  "lag": {
    "minimum_ms": 0,
    "maximum_ms": 500,
    "step_ms": 10,
    "tie_relative_tolerance": 0.005,
    "fit_force_min_N": 0.05,
    "fit_force_max_N": 3.0
  },
  "contact": {
    "no_contact_frame_fpr_target": 0.05,
    "recall_target": 0.9,
    "scale_force_min_N": 0.25,
    "scale_force_max_N": 1.0,
    "scale_session_quantile": 0.9,
    "noise_scale_session_quantile": 0.99,
    "minimum_scale": 1.0
  },
  "range": {
    "nominal_max_N": 3.0,
    "force_bin_width_N": 0.25,
    "minimum_sessions_per_bin": 3,
    "initial_force_max_N": 1.0,
    "sensitivity_fraction": 0.2,
    "consecutive_bins": 3,
    "safe_limit_fraction_below_knee": 0.9,
    "loading_derivative_threshold_N_s": 0.02,
    "loading_smoothing_frames": 5
  },
  "optical_support": {
    "feature_order": [
      "roi1_corrected_light_per_pixel", "roi1_active_fraction", "roi1_raw_v_mean",
      "roi2_corrected_light_per_pixel", "roi2_active_fraction", "roi2_raw_v_mean",
      "roi3_corrected_light_per_pixel", "roi3_active_fraction", "roi3_raw_v_mean",
      "roi4_corrected_light_per_pixel", "roi4_active_fraction", "roi4_raw_v_mean",
      "roi5_corrected_light_per_pixel", "roi5_active_fraction", "roi5_raw_v_mean",
      "roi6_corrected_light_per_pixel", "roi6_active_fraction", "roi6_raw_v_mean",
      "roi7_corrected_light_per_pixel", "roi7_active_fraction", "roi7_raw_v_mean",
      "roi8_corrected_light_per_pixel", "roi8_active_fraction", "roi8_raw_v_mean",
      "roi9_corrected_light_per_pixel", "roi9_active_fraction", "roi9_raw_v_mean"
    ],
    "envelope_quantiles": [0.001, 0.999],
    "margin_options": [0.0, 0.05, 0.1],
    "distance_quantile_options": [0.99, 0.995, 0.999],
    "max_samples_per_stratum": 200,
    "max_reference_samples": 2000,
    "inner_retention_target": 0.99,
    "robust_scale_floor": 1e-06
  },
  "seed": 1729
}
